{
  "node_id": "node_refresh_report",
  "task_id": "task_weekly_report_2026w15",
  "node_type": "report_refresh",
  "objective": "Update report workbook from source data",
  "desired_delta": {
    "workbook_status": "refreshed"
  },
  "evidence_of_done": {
    "requires_artifact": "artifact_report_xlsx"
  },
  "risk_class": "R1",
  "state": "ready",
  "dependencies": [],
  "required_capabilities": [
    "filesystem.write",
    "spreadsheet.update"
  ],
  "principal_ref": "principal.user.primary",
  "resource_owner_ref": "owner.workspace.primary",
  "grant_refs": [],
  "artifact_refs": [
    "artifact_report_xlsx",
    "artifact_source_csv"
  ],
  "version": 1,
  "created_at": "2026-04-10T11:00:00+08:00",
  "updated_at": "2026-04-10T11:00:00+08:00"
}
